<?xml version="1.0"?>
<!DOCTYPE component PUBLIC "SYSTEM" "http://corepl.us/api/2_4/component.dtd">
<component xmlns:xsi="http://www.w3.org/2001/XMLSchema-instance" version="2.4.3" name="Theme" execmode="web">
	<requires>
		<require name="core" type="component" version="3.5.0" operation="ge"/>
		<require name="jquery" type="library" version="1.7.0" operation="ge"/>
		<require name="jqueryui" type="library" version="1.8.0" operation="ge"/>
	</requires>
	<hooks>
		<hook name="/core/components/loaded" call="ThemeHandler::Load"/>
	</hooks>
	<files>
		<file filename="CHANGELOG" md5="5d4c793fa4044fe1d52786fd604f36b7"/>
		<file filename="controllers/ThemeController.class.php" md5="39b9f4686be70fc025f2d444ef2baf94">
			<controller name="ThemeController"/>
		</file>
		<file filename="functions/common.php" md5="6d8e7b9aa1cb62b63e5233ed4b824b0b"/>
		<file filename="libs/Theme/Theme.php" md5="f4970155987c165172c8a4b56e974407">
			<class name="Theme\Theme"/>
		</file>
		<file filename="libs/ThemeHandler.class.php" md5="f9406dd7a2af3c1e76ae3c90f57dc62f">
			<class name="ThemeHandler"/>
		</file>
		<file filename="models/ThemeTemplateChangeModel.php" md5="4e14433a608d4d43bd55910fb7c9c172">
			<class name="ThemeTemplateChangeModel"/>
		</file>
	</files>
	<view>
		<file filename="templates/pages/theme/editor.tpl" md5="533b2423a66182e692136eefa142f081"/>
		<file filename="templates/pages/theme/index.tpl" md5="bacb86ad000baf6c53b4a525abd455f1"/>
		<file filename="templates/pages/theme/selectstylesheets.tpl" md5="47956fc42e0954353264ab3d2f5c0e59"/>
		<file filename="templates/pages/theme/setdefault.tpl" md5="835a5142fdb7c580502a6413909a89e0"/>
	</view>
	<pages>
		<page baseurl="/theme" admin="1" access="g:admin" title="Theme Manager" group="Theme and Layouts"/>
	</pages>
	<configs>
		<config key="/theme/default_template" type="string" default="basic.tpl" description=""/>
		<config key="/theme/default_admin_template" type="string" default="basic.tpl" description=""/>
		<config key="/theme/default_email_template" type="string" default="" description=""/>
		<config key="/theme/selected" type="string" default="base-v3" description=""/>
	</configs>
	<assets>
		<file filename="assets/css/theme/admin.css" md5="de1b2508bc649081b8e58fc4d8df2243"/>
		<file filename="assets/css/theme/widgets.css" md5="c30e4f3c1849a829d1bfc47fd9eecd0a"/>
		<file filename="assets/js/theme/widgets.js" md5="0ac5f62b8fb3bddc6c918379a01ed36f"/>
	</assets>
	<description/>
	<upgrades>
		<upgrade from="0.0.1" to="1.9.0"/>
		<upgrade from="1.9.0" to="1.9.1"/>
		<upgrade from="1.9.1" to="1.9.2"/>
		<upgrade from="1.9.2" to="2.0.0"/>
		<upgrade from="2.0.0" to="2.0.1"/>
		<upgrade from="2.0.1" to="2.0.2"/>
		<upgrade from="2.0.2" to="2.0.3b1"/>
		<upgrade from="2.0.3b1" to="2.0.3"/>
		<upgrade from="2.0.3" to="2.0.4"/>
		<upgrade from="2.0.4" to="2.0.5"/>
		<upgrade from="2.0.5" to="2.0.6"/>
		<upgrade from="2.0.6" to="2.1.0"/>
		<upgrade from="2.1.0" to="2.1.1"/>
		<upgrade from="2.1.1" to="2.1.2"/>
		<upgrade from="2.1.2" to="2.1.3"/>
		<upgrade from="2.1.3" to="2.1.4"/>
		<upgrade from="2.1.4" to="2.1.5"/>
		<upgrade from="2.1.5" to="2.2.0"/>
		<upgrade from="2.2.0" to="2.3.0"/>
		<upgrade from="2.3.0" to="2.4.0"/>
		<upgrade from="2.4.0" to="2.4.1"/>
		<upgrade from="2.4.1" to="2.4.2"/>
		<upgrade from="2.4.2" to="2.4.3"/>
	</upgrades>
	<authors>
		<author name="Charlie Powell" email="charlie@evalagency.com"/>
		<author name="Nick Hinsch &lt;nicholas@evalagency.com"/>
		<author name="Nick Hinsch" email="nicholas@evalagency.com"/>
	</authors>
	<licenses>
		<license url="http://www.gnu.org/licenses/agpl.html">
			GNU Affero General Public License v3
		</license>
	</licenses>
</component>

