<?xml version="1.0" encoding="UTF-8"?>
<!DOCTYPE component SYSTEM "component.dtd">
<component xmlns:xsi="http://www.w3.org/2001/XMLSchema-instance" version="1.0.0" name="GoogleAnalytics" execmode="web">
	<requires name="core" type="component"/>
	<hook name="/core/page/prerender" call="GoogleAnalyticsHelper::InstallTracking"/>
	<library>
		<file filename="GoogleAnalyticsHelper.class.php" md5="c1687939d9fb75d2f92ad2b2f49a47f7">
			<provides type="class" name="GoogleAnalyticsHelper"/>
		</file>
	</library>
	<description>
		Provides google analytics integration.
	</description>
	<configs>
		<config key="/google-analytics/accountid" type="string" default="" description="This is the Account ID (sometimes called 'Web Property ID') listed for this account in google analytics."/>
	</configs>
	<changelog version="1.0.0">
		<packagemeta>
			<date>Wed, 28 Sep 2011 03:28:48 -0400</date>
			<maintainer name="Charlie Powell" email="powellc@powelltechs.com"/>
			<packager>CAE2 0.0.6</packager>
		</packagemeta>
		<notes>Initial version</notes>
	</changelog>
	<otherfiles/>
</component>

